Book Id,Title,Author,Author l-f,Additional Authors,ISBN,ISBN13,My Rating,Average Rating,Publisher,Binding,Number of Pages,Year Published,Original Publication Year,Date Read,Date Added,Bookshelves,Bookshelves with positions,Exclusive Shelf,My Review,Spoiler,Private Notes,Read Count,Recommended For,Recommended By,Owned Copies,Original Purchase Date,Original Purchase Location,Condition,Condition Description,BCID
20653299,Comix Record,Alessandro Sisti,"Sisti, Alessandro","Claudio Sciarrone, Francesco Artibani, Tito Faraci, Corrado Mastantuono, Enrico Faccini, Massimo Marconi, Massimo De Vita, Marco Bosco, Nicola Tosolini, Isabel Canhoto, Marta Amaral","=""""","=""""",3,3.00,Goody,Paperback,130,2013,2013,2014/01/30,2014/01/29,,,read,"Como qualquer cromo literário que se preze, tenho um fraquinho por edições de coleccionador, limitadas, especiais, de luxo, seja o que for. Esta Comix Record ainda por cima tinha uma premissa fantástica: reunir histórias que se destacaram de alguma forma.<br/><br/>Desde a mais pequena (uma história inteira impressa numa só página!!), à mais romântica, passando por uma sem diálogos e até por uma sem desenhos, esta pequena BD é uma delícia.<br/><br/>A primeira é exactamente a mais pequena de sempre, de tal forma que na altura da publicação original a revista foi vendida com uma lupa. A revista apresenta a versão original e depois uma versão em tamanho normal. Chama-se Mickeyzinhoinho, e é uma história engraçada, que brinca com paradoxos temporais e máquinas que encolhem coisas. Não é nada de extraordinário, mas tem um valor histórico curioso.<br/><br/>Depois vem Mickey e o rio do tempo. A princípio fiquei duvidoso, porque pensei que fosse uma modernização da história antiga mais conhecida do Mickey, mas não, é uma homenagem/sequela bastante bem feita e que me agradou. Foi porreiro ver o Bafo e o Mickey a trabalhar juntos, e os camponeses ricos por causa do peixe que engoliu o diamente (twist! ah!), e o final com os dois a partilharem aperitivos, foi bonito.<br/><br/>Dois passos no parque, centrada no Peninha (e na sua aselhice), tem o Tio Patinhas, o Donald e os três sobrinhos a gozarem com o desgraçado numa história sem uma única fala. Apenas imagens. Bem executada, mas esperava muito mais, talvez uma qualquer razão para não haver falas (além do ""bora fazer humor mudo"", o que não é completamente mau).<br/><br/>Huguinho, Zezinho e Luisinho, e o tempo das maçãs, nada má, a história toda amorosa e o catano... A princípio torci o nariz (pelas mesmas razões do ilustrador, aparentemente), mas depois até gostei, confesso.<br/><br/>Por fim vem Patos às apalpadelas, que por um lado foi a decepção do livro. Uma história de BD sem desenhos, só falas, por causa de um apagão na Caixa Forte, quando lá se estava a festejar o primeiro negócio do ano para o Tio Patinhas. Gostei, e a coisa está bem feita, mas tem demasiadas personagens e fica confuso.<br/><br/>De destacar ainda a pequena introdução história que antecede cada história e que é sempre um bom complemento a este tipo de coisas. Um livro agradável, que podia ter sido bem melhor, mas que não pecou muito, e que é sem dúvida obrigatório para coleccionadores!<br/><br/>http://livrosimples.blogspot.pt/2014/02/comix-record.html",,,1,,,0,,,,,
8082761,Mal Por Mal,F. Scott Fitzgerald,"Fitzgerald, F. Scott",,"=""""","=""9726956153""",3,3.25,Teorema,Paperback,63,2005,1930,2014/01/29,2014/01/27,,,read,"Livro pequeno, praticamente um conto. Não fiquei fã. Até agora tenho gostado do que tenho lido deste autor, mas este achei bastante mediano.<br/><br/>Os temas são os habituais: o glamour e a decadência de um certo estilo de vida americana. Fachadas e hipocrisias, amores e desamores, etc.<br/><br/>Mas desta vez não estava a pegar. Quase até ao fim o livro pareceu-me apenas uma descrição de pessoas vazias, sem qualquer propósito. Nem as pessoas nem a descrição.<br/><br/>A história de um encenador de teatro arrogante, e da sua amada com sonhos de ser bailarina não me estava a convencer. Mas há um momento perto do fim em que tudo muda e permite pôr tudo o que aconteceu em perspectiva. E o final é bom!<br/><br/>Percebo que a ideia talvez até tenha sido esta desde o início: uma história seca e aborrecida, com um acontecimento perto do fim que muda tudo. A perspectiva altera-se e as conclusões tiram-se de forma quase imediata. Mas acho que o autor não executou muito bem, e embora o contraste funcione, não funciona tão bem como poderia. Uma pena.<br/><br/>http://livrosimples.blogspot.pt/2014/02/mal-por-mal.html",,,1,,,0,,,,,
1074342,"The Lazarus Vendetta (Covert-One, #5)",Patrick Larkin,"Larkin, Patrick",,"=""0752864122""","=""9780752864129""",3,4.01,Orion Books Ltd,Paperback,417,2005,2004,2014/01/27,2014/01/14,,,read,"Desenganem-se rapidamente de duas coisas: o facto deste livro ser o quinto de uma série é completamente irrelevante, e o autor no verdadeiro sentido da palavra é Patrick Larkin.<br/><br/>Passo a explicar: a sequência e continuação dentro da série é um aspecto secundário, há apenas pequenos pormenores em que se nota que o autor faz referências a livros passados, mas nada de especial. As personagens são bem caracterizadas, os acontecimentos bem explicados, e nada se perde.<br/><br/>Agora o autor. Como se vê na capa, aparece ROBERT LUDLUM em letras garrafais, seguido de um ""Robert Ludlum e Patrick Larkin"". Eu pensei que o autor era o Ludlum e que o Larkin tinha dado uma ajuda. Mas não. Ludlum morreu antes do primeiro livro da série ser sequer escrito!<br/><br/>Ele criou a série, deixou uma série de notas e guias, e um grupo de escritores, como Patrick Larkin, é que escreveram de facto os livros.<br/><br/>Embora esta abordagem me faça alguma confusão, não condeno, é a faceta empresarial da escrita: cria-se um produto, arranja-se alguém que execute, fazem-se rios de dinheiro. Se o livro ficar bem feito, não me queixo (muito). O que me chateia é a forma como enganam o leitor: em lado nenhum se deixa bem claro que quem escreveu o livro foi Patrick Larkin e não Robert Ludlum. Só o soube depois de uma pequena pesquisa.<br/><br/>Mas tirando estes dois pormenores, tenho a dizer que gostei do livro, embora não o tenha achado nada de especial. É um thriller político e ambientalista, em que os ambientalistas que condenam os avanços tecnológicos, especialmente as nanocoisas, são os verdadeiros vilões. Nada de muito novo. O que o autor consegue fazer é escrever um relato cativante sobre um Jon Smith, membro da Covert-One, uma organização tão secreta que nem as organizações secretas americanas sabem que ela existe, e a sua busca por respostas.<br/><br/>O protagonista está bem construído, e explora bem a dicotomia entre Jon Smith, o cientista especialista em microbiologia, e Jon Smith, o agente secreto (vulgo espião) topo de gama. O resto das personagens também é bastante interessante, mas apenas uma consegue roubar algum do protagonismo de Jon, Peter Howell, agente reformado do MI6, com a sua forma de falar exageradamente britânica e um carisma muito peculiar.<br/><br/>As intrigas andam sempre ao rubro, mas o mistério não é grande mistério: antes de metade do livro já eu tinha topado o que se andava a passar. Destaque no entanto para as personagens dos Horatii, um trio de assassinos gigantescos geneticamente melhorados com uma presença imponente em cada página em que aparecem.<br/><br/>A pior parte foi mesmo o fim, não exactamente pouco satisfatório, mas apressado. Todos conspiram, todos jogam a dobrar, o ritmo é tão acelerado que 400 páginas contam a história de mais ou menos 6 dias, e depois no fim tudo acaba demasiado facilmente. Gostava de ter visto mais complicações e um final mais elaborado, mas não ficou mau de todo.<br/><br/>http://livrosimples.blogspot.pt/2014/01/the-lazarus-vendetta-covert-one-5.html",,,1,,,0,,,,,
16175414,Siddhartha,Hermann Hesse,"Hesse, Hermann",Hilda Rosner,"=""0811219763""","=""9780811219761""",3,4.04,New Directions,ebook,128,2010,1922,2014/01/14,2014/01/07,,,read,"á há algum tempo que tenho bastante curiosidade relativamente a este autor, um prémio Nobel, alemão (li pouco de alemães) e com boa fama. Este livro, pequenito, pareceu-me o ideal para servir de introdução à sua obra.<br/><br/>A verdade é que é mesmo pequeno, Siddartha consegue ser bastante pesado, à sua maneira. Siddartha é o filho de um Brahman, uma espécie de sacerdote hindu, que é criado com o intuito de se tornar, ele próprio um Brahman.<br/><br/>Mas Siddartha tem uma mente pensante bastante activa e começa a magicar umas ideias e umas conclusões sobre a sua religiosidade e o que significa atingir de facto a santidade e a liberdade e paz de espírito, e conclui que aquele não é o caminho certo.<br/><br/>Segue então para os Samanas, uns eremitas ascéticos que tentam atingir a paz e a superioridade espiritual através da renúncia total a toda e qualquer posse. Siddartha é acompanhado nesta viagem por Govinda, um amigo de infância que muito o admira e à sua mentalidade.<br/><br/>Aqui é que tudo começa a ficar interessante. Depois de algum tempo entre os Samanas, o protagonista apercebe-se de que já ouviu tudo o que havia para ouvir e que aquilo não é para ele. Nem devia ser para ninguém. Ah! A conclusão dele é que não se pode simplesmente aprender a ser santo e elevado através dos ensinamentos de ninguém, por mais místicos e iluminados que os ensinamentos e os próprios professores sejam.<br/><br/>O ciclo volta a repetir-se e Siddartha parte outra vez, acompanhado de Govinda, e prossegue numa viagem espiritual e de crescimento pessoal em que se dedica a atingir a plena paz de espírito através da única maneira que acha possível: vivendo.<br/><br/>É interessante ver Siddartha a encontrar Gotama, o Buda, e a recusar os seus ensinamentos, ainda que reconheça alguém que atingiu o que ele quer atingir, para depois passar uma temporada a viver como uma ""pessoa normal"", sem renunciar a nada, tornando-se inclusivamente rico e cedendo às tentações da carne com bastante frequência.<br/><br/>A evolução de Siddartha é fascinante. Evolução e constante retrocesso, como se cada passo que desse o fizessem perceber de que estava apenas a voltar atrás. O que é transmitido ao longo da história é uma abordagem surpreendentemente sensata à vida: nem renunciar a tentações nem a prazeres, mas antes vivendo os dois, só assim é que alguém cresce, aprende e pode almejar atingir a paz de espírito.<br/><br/>Pelo meio há uns meandros filosóficos relativamente intricados, especialmente na sua estadia com um velhote simpático e sábio, mas que se revelam profundamente simples, no fim. O truque é exactamente não pensar demasiado nas coisas. Uma conclusão interessante para o protagonista, que tem um fim condigno.<br/><br/>No meio disto, a história em si não me conseguiu cativar por aí além, e muito menos a escrita, mas o livro é antigo e traduzido, portanto dou-lhe o benefício da dúvida. É uma leitura interessante, isso sem dúvida, mas que peca pela falta de características que permitam a identificação com o leitor, algo que acho que seria essencial numa obra deste género.<br/><br/>Mas também acho que é daqueles livros que cada pessoa lê de forma completamente diferente, portanto aventurem-se!<br/><br/>http://livrosimples.blogspot.pt/2014/01/siddartha.html",,,1,,,0,,,,,
10867108,O Limite de Rudzky,António de Macedo,"Macedo, António de",,"=""9722107496""","=""9789722107495""",5,3.62,Caminho,Paperback,196,1992,1992,2014/01/06,2014/01/03,,,read,"Tinha este livro à espera desde a Feira do Livro do ano passado, e o facto de ter conseguido um autógrafo do autor durante o Fórum Fantástico serviu de incentivo para o empurrar mais para a frente da fila.<br/><br/>Terminada a leitura dos 3 contos que contém, não consigo evitar pensar nas tremendas pérolas que posso ter escondidas nas prateleiras ""a ler""... É que este livro é fantástico, absolutamente fantástico.<br/><br/>Já esperava que fosse qualquer coisa de especial, tendo em conta o que conheço do autor (ainda que só lhe tenha lido O Sangue e o Fogo), mas confesso que superou largamente as minhas expectativas, por uma razão muito simples: a escrita.<br/><br/>Seja a contar que história for, Macedo consegue escrever de uma forma excepcional. Fiquei seriamente embasbacado e impressionado. Nas peças de teatro que li anteriormente esse aspecto não era tão visível, mas aqui é límpido e cristalino como a água da montanha.<br/><br/>O primeiro conto é O limite de Rudzky, uma história bem contada que consegue fazer uma ligação interessante entre os fenómenos físicos, químicos, biológicos, fisiológicos e psicológicos, de tudo o que existe, e o sobrenatural. Sem querer revelar muito, talvez devam pensar duas vezes sobre como funciona a electricidade...<br/><br/>Ainda por cima é um conto essencialmente sobre ciência. Matemática, física, trotinetes voadoras, detectores de neutrinos, há de tudo um pouco, em conjunto com temas mais sobrenaturais que adicionam um certo véu de mistério e de imprevisibilidade que cai muito bem com o resto da história.<br/><br/>Depois vem A noiva vestida de nuvens, bastante mais complicado de ler do que o conto anterior, de tal forma está revestido de simbolismo e noções herméticas e ocultistas e sei lá. O que é interessante é que ainda assim conseguiu causar um profundo efeito em mim.<br/><br/>A escrita, incluindo os diálogos, é trabalhada e complexa sem se tornar propriamente densa, e tudo soa a artificial, de certa forma, especialmente os diálogos, muito pouco naturais, mas a voz do autor consegue causar uma impressão de tal forma intensa que tudo encaixa na perfeição. Aqui já há inspirações lovecraftianas, e uma série de conceitos brutais, como o ""dialecto flamejante"":<br/><br/>""[...] deixou cair no lume o manuscrito original, e imediatamente uma espectacular chuva de luzes, sons e cores referveu das páginas prodigiosas, que se enegreceram e encarquilharam sob a acção do fogo sem sofrer todavia maior dano do que essa superficial deformação. Um outro discípulo teve a instantânea e feliz ideia de transcrever os sons musicais que retiniam enquanto as chamas abrasavam o manuscrito; um terceiro copiou a sequência de luzes e cores irradiadas durante o fantasmagórico processo. [...] teve uma revelação súbita e vislumbrou o código que relacionava os terríveis símbolos do «dialecto flamejante» com a sequência anotada de cores e sons musicais.""<br/><br/>Por fim há Perpetuamente Perpétua, que além de ter um bom título, é o mais longo e possivelmente o melhor, embora eu tenha muita dificuldade em escolher. Só sei que por ser mais longa, acaba por ser mais estruturada e trabalhada, e a aldeia perdida no meio do nada, onde uma rapariga doente vai passar umas férias com os avós, é o cenário semi-idílico perfeito para o enredo convoluto de Macedo.<br/><br/>Com mistérios do oculto e companhia limitada ao virar de cada esquina, Perpetuamente Perpétua é uma história surpreendente: as personagens aparecem com várias idades, cruzando-se e comunicando consigo próprias, há uma voz retumbante e misteriosa pertencente a um mensageiro do fogo, e a própria Perpétua, ora mulher de meia idade, ora jovem virginal de 18 anos, ora idosa de rugas vincadas, a personagem central (não a protagonista) do conto e uma das personagens mais intrigantes que encontrei na minha vida.<br/><br/>Macedo consegue assim, num diálogo entre mistérios iniciáticos, comunhão com a Natureza e tudo aquile que uma aldeia destas perdida num canto solarengo de Portugal tenha de típico, construir um conto fabuloso que me deixou a salivar por mais, mas que conseguiu ter um fim bastante definitivo e satisfatório.<br/><br/>No geral, um livro excelente. Caso ainda não tenham percebido, é um livro a ler e um autor a conhecer. Estão à espera de quê? Siga!<br/><br/>http://livrosimples.blogspot.pt/2014/01/o-limite-de-rudzky.html",,,1,,,0,,,,,
834378,"A Pocket Full of Rye (Miss Marple, #7)",Agatha Christie,"Christie, Agatha",,"=""0451199863""","=""9780451199867""",3,3.88,Signet,Paperback,220,2000,1953,2014/01/03,2013/12/31,,,read,"Este pequeno livro, comprado com um mega desconto qualquer que o deixou a menos de três euros, pareceu ser a obra ideal para desanuviar um pouco. Em época de exames não me apetece propriamente ler o Guerra e Paz, ou algo parecido, e acho sempre os livros de Agatha Christie tão agradáveis e leves, que pronto.<br/><br/>Como se pode ver ali, em vez de Poirot contamos com Miss Marple, que também é fixe. É uma personagem curiosa, obviamente, uma típica senhora inglesa que transmite uma certa sensação de frieza, principalmente de raciocínio, que me espanta sempre.<br/><br/>E esta história tem uma das particularidades que eu mais aprecio nas histórias da rainha dos policiais: a sua personagem, a Miss Marple, pouco aparece. A sério, só surge a meio do livro, em não mais do que três ou quatro capítulos a partir, e é só.<br/><br/>Já nos dois melhores livros que li de Agatha Christie, As Dez Figuras Negras, e O Assassinato de Roger Ackroyd, se passa o mesmo. Aliás, no primeiro nem sequer aparece o Poirot! Mas é algo que a autora costuma fazer, dá muita informação e muita história antes de começarem a acontecer os crimes, permitindo uma maior envolvência na trama. Sempre achei isso fenomenal, especialmente tendo em conta a mestria com que Agatha Christie o faz.<br/><br/>É que mesmo com este ""atraso"" na resolução do mistério, os seus detectives conseguem criar um impacto enorme. A Pocket Full of Rye não é excepção, com Miss Marple a resolver o mistério de forma peculiar e muito astuta, baseada apenas em alguns dedos de conversa, maioritariamente com as mulheres, e fazendo a ligação com uma rima infantil.<br/><br/>Impressionante e moderadamente interessante, ainda assim o livro ficou aquém. O mistério era muito, e as personagens interessantes, mas o desenvolvimento foi bastante mediano. O verdadeiro culpado foi (mais ou menos) surpreendente, mas disso até nem me queixo. Acho é que o livro é demasiado pequeno, e com a autora a ter enredo antes do trabalho de detective, não lhe fazia mal nenhum ter mais umas poucas páginas a expandir a história.<br/><br/>http://livrosimples.blogspot.pt/2014/01/a-pocket-full-of-rye.html",,,1,,,0,,,,,
17571323,Polarity,Max Bemis,"Bemis, Max","Jorge Coelho, Felipe Sobreiro","=""1608863468""","=""9781608863464""",3,3.70,BOOM! Studios,Paperback,112,2013,2013,,2014/01/11,,,read,,,,1,,,0,,,,,
20347589,Disney Big #2,Guido Martina,"Martina, Guido","Giovan Battista Carpi, Rodolfo Cimino, Giorgio Cavazzano, Giulio Chierchini, Jerry Siegel, Giorgio Bordini, Romano Scarpa, Giorgio Pezzin, Massimo De Vita, Abramo Barosso, Giampaolo Barosso, Osvaldo Pavese, Carlo Gentina, Guido Scala, Sergio Asteriti, Giuseppe Perego, Michele Gazzarri, Luciano Gatto, Carlo Panaro, Renzo Arbore, Alessandro Sisti","=""""","=""""",3,2.75,Goody,Mass Market Paperback,512,2013,2013,2013/11/20,2013/12/29,,,read,,,,1,,,0,,,,,
20347527,Disney Big #1,Rodolfo Cimino,"Cimino, Rodolfo","Romano Scarpa, Luciano Milano, Bruno Sarda, Nicola Tosolini, Jerry Siegel, Giuseppe Perego, Carlo Gentina, Francesco Guerrini, Giorgio Cavanazzo, Gian Giacomo Dalmasso, Pier Lorenzo De Vita, Manuela Marinato, Guido Scala, Nino Russo, Maurizio Amendola, Bruno Concina, Paolo Ongaro, Maria Luisa Uggetti, Giorgio Bordini, Fabio Michelini, Alessandro Barbucci, Massimo De Vita, Giampaolo Barosso, Luciano Gatto","=""""","=""""",3,2.67,Goody,Mass Market Paperback,512,2013,2013,2013/09/25,2013/12/29,,,read,,,,1,,,0,,,,,
7539249,Marvel Fairy Tales,C.B. Cebulski,"Cebulski, C.B.","Claire Wendling, João M.P. Lemos, Nuno Plati, Takeshi Miyazawa, Ricardo Tércio Vinagre Guimarães, Kyle Baker","=""0785143165""","=""9780785143161""",4,3.21,Marvel,Paperback,144,2010,2010,2013/12/29,2013/12/28,,,read,,,,1,,,0,,,,,
55399,"Gardens of the Moon (Malazan Book of the Fallen, #1)",Steven Erikson,"Erikson, Steven",,"=""0765348780""","=""9780765348784""",2,3.88,Tor Books,Mass Market Paperback,657,2005,1999,2013/12/29,2013/12/09,,,read,,,,1,,,0,,,,,
13092472,Batman - Colheita Infernal (Clássicos Batman),George Pratt,"Pratt, George",Paulo Moreira,"=""9895591179""","=""""",2,2.98,Edições Devir,Paperback,96,2005,2000,2013/12/26,2013/12/26,,,read,,,,1,,,0,,,,,
19542821,Disney Especial: Natal,Tito Faraci,"Faraci, Tito","Marco Mazzarello, Giampaolo Soldati, Silvia Ziche, Bruno Sarda, Massimo De Vita, Gaja Arrighini, Andrea Freccero, Carlo Panaro, Maria Luisa Uggetti, Matteo Venerus, Vitale Mangiatordi, Marco Bosco, Giorgio Cavazzano, Stefano Ambrosio, Donald Soffritti, Bruno Enna, Robert Viam, Maurizio Amendola","=""""","=""""",3,3.43,Goody,Mass Market Paperback,320,2013,2013,2013/12/26,2013/12/17,,,read,,,,1,,,0,,,,,
19540564,Disney Especial: Horror,Carlo Panaro,"Panaro, Carlo","Massimo De Vita, Augusto Machetto, Daniela Vetro, Francesco Guerrini, Francesco D'Ippolito, Fausto Vitaliano, Andrea Freccero, Nino Russo, Giorgio Di Vita, Valerio Held, Casty, Silvio Camboni, Giampaolo Soldati, Marco Gervasio, Marco Bosco, Luciano Milano","=""""","=""""",3,3.50,Goody,Mass Market Paperback,320,2013,2013,2013/12/17,2013/12/17,,,read,,,,1,,,0,,,,,
479621,"Green Lantern, Volume 3: Wanted: Hal Jordan",Geoff Johns,"Johns, Geoff","Ivan Reis, Daniel Acuña, Oclair Albert","=""1401213391""","=""9781401213398""",3,3.82,DC Comics,Hardcover,144,2007,2007,2013/12/12,2013/12/10,,,read,,,,1,,,0,,,,,
555363,"Green Lantern, Volume 2: Revenge of the Green Lanterns",Geoff Johns,"Johns, Geoff","Carlos Pacheco, Ethan Van Sciver, Ivan Reis","=""1401211674""","=""9781401211677""",3,3.86,DC Comics,Hardcover,164,2006,2006,2013/12/10,2013/12/09,,,read,,,,1,,,0,,,,,
160844,"Green Lantern, Volume 1: No Fear",Geoff Johns,"Johns, Geoff","Carlos Pacheco, Ethan Van Sciver, Darwyn Cooke, Simone Bianchi","=""140120466X""","=""9781401204662""",3,3.85,DC Comics,Hardcover,176,2006,2006,2013/12/09,2013/12/04,,,read,,,,1,,,0,,,,,
5739604,O Despertar da Magia (As Crónicas de Gelo e Fogo #4),George R.R. Martin,"Martin, George R.R.",Jorge Candeias,"=""9896370486""","=""9789896370480""",4,4.40,Edições Saída de Emergência,Paperback,416,2008,1998,2013/12/09,2013/11/27,,,read,,,,1,,,0,,,,,
17560013,Sin City – Cidade do Pecado,Frank Miller,"Miller, Frank",,"=""""","=""9788525016201""",5,4.15,Globo,Paperback,,,1991,2013/03/22,2013/03/18,,,read,,,,1,,,0,,,,,
298290,"Dream Country (The Sandman, #3)",Neil Gaiman,"Gaiman, Neil","Kelley Jones, Charles Vess, Colleen Doran, Malcolm Jones III, Steve Erickson","=""156389016X""","=""9781563890161""",4,4.24,Vertigo,Paperback,160,1995,1990,2013/11/27,2013/11/25,,,read,,,,1,,,0,,,,,
5739533,A Fúria dos Reis (As Crónicas de Gelo e Fogo #3),George R.R. Martin,"Martin, George R.R.",Jorge Candeias,"=""9896370265""","=""9789896370268""",4,4.36,Edições Saída de Emergência,Paperback,480,2008,1998,2013/11/25,2013/11/13,,,read,,,,1,,,0,,,,,
25099,"The Doll's House (The Sandman, #2)",Neil Gaiman,"Gaiman, Neil","Steve Parkhouse, Chris Bachalo, Michael Zulli, Mike Dringenberg, Malcolm Jones III, Todd Klein, Clive Barker","=""1563892251""","=""9781563892257""",4,4.44,Vertigo,Hardcover,232,1999,1990,2013/11/13,2013/11/10,,,read,,,,1,,,0,,,,,
11265577,Brasil,Ian McDonald,"McDonald, Ian",Leonor Bizarro Marques,"=""9895575661""","=""9789895575664""",3,3.67,Gailivro,Paperback,512,2008,2007,2013/11/10,2013/10/28,,,read,,,,1,,,0,,,,,
18222114,"Liga da Justiça: Terra Dois (Super-Heróis DC Comics, #1)",Grant Morrison,"Morrison, Grant","Frank Quitely, Ed McGuinness","=""""","=""9789896823498""",3,3.80,Levoir,Hardcover,176,2013,2013,2013/10/24,2013/10/22,,,read,,,,1,,,0,,,,,
6339089,O Artista Da Morte,Daniel Silva,"Silva, Daniel",,"=""9722516760""","=""9789722516761""",3,4.00,Bertrand Editora,Paperback,396,2008,2000,2013/10/21,2013/10/13,,,read,,,,1,,,0,,,,,
17656625,"Comics Star Wars: Clássicos 12 (Comics Star Wars, #12)",Jo Duffy,"Duffy, Jo","Renato Neves, Petra Goldberg, Michelle Wrightson, Daina Grazinus, Elaine Lee, José Vala Roberto, Cynthia Martin, Sal Buscema, Sam de la Rosa, Art Nichols, Steve Leialoha, Ken Steacy, Whilce Portacio","=""""","=""""",2,3.55,Planeta DeAgostini,Hardcover,200,2013,2013,2013/10/13,2013/10/12,,,read,,,,1,,,0,,,,,
6728465,Minha Besta,Christopher Moore,"Moore, Christopher",Leonor Bizarro Marques,"=""""","=""9789895575657""",2,3.83,Gailivro,Paperback,344,2008,2007,2013/10/12,2013/10/08,,,read,,,,1,,,0,,,,,
10117321,A Última Amante de Hachiko,Banana Yoshimoto,"Yoshimoto, Banana",António Barrento,"=""972879195X""","=""9789728791957""",3,3.40,Cavalo de Ferro,Paperback,104,2005,1994,2013/10/08,2013/10/05,,,read,,,,1,,,0,,,,,
1138654,The Gods of Pegana,Lord Dunsany,"Dunsany, Lord",S.H. Sime,"=""1599868857""","=""9781599868851""",3,3.88,Fq Classics,Paperback,104,2007,1905,2013/08/18,2013/10/01,,,read,,,,1,,,0,,,,,
18524570,Palmas para o Esquilo,David Soares,"Soares, David",Pedro Serpa,"=""9789898673""","=""9789898673015""",4,3.57,Kingpin Books,Paperback,52,2013,2013,2013/09/22,2013/09/21,,,read,,,,1,,,0,,,,,
7368300,A Queda,Albert Camus,"Camus, Albert",José Terra,"=""""","=""9789723828696""",4,4.02,Livros do Brasil,Paperback,113,2007,1956,2013/09/07,2013/09/07,,,read,,,,1,,,0,,,,,
17656527,"Comics Star Wars: Clássicos 11 (Comics Star Wars, #11)",Jo Duffy,"Duffy, Jo","Archie Goodwin, Cynthia Martin, Steve Leialoha, Bob Wiacek, Art Nichols, Al Williamson, Ron Frenz, Sam de la Rosa, Renato Neves, José Vala Roberto, Jan Duursema, Tom Mandrake, Glynis Oliver, Sal Buscema, Tom Palmer, Petra Goldberg","=""""","=""""",3,3.62,Planeta DeAgostini,Hardcover,,2013,2013,2013/09/06,2013/09/07,,,read,,,,1,,,0,,,,,
