Book Id,Title,Author,Author l-f,Additional Authors,ISBN,ISBN13,My Rating,Average Rating,Publisher,Binding,Number of Pages,Year Published,Original Publication Year,Date Read,Date Added,Bookshelves,Bookshelves with positions,Exclusive Shelf,My Review,Spoiler,Private Notes,Read Count,Recommended For,Recommended By,Owned Copies,Original Purchase Date,Original Purchase Location,Condition,Condition Description,BCID
626339,"Nausicaä of the Valley of the Wind, Vol. 1 (Nausicaä of the Valley of the Wind, #1)",Hayao Miyazaki,"Miyazaki, Hayao","David Lewis, Toren Smith, Kaori Inoue, Joe Yamazaki","=""1591164087""","=""9781591164081""",3,4.46,VIZ Media,Paperback,130,2004,1982,2017/06/28,2017/06/27,,,read,,,,1,,,0,,,,,
6603017,Laços de Família,Clarice Lispector,"Lispector, Clarice",,"=""""","=""""",4,4.00,Relógio D'Água Editores,Paperback,123,1990,1960,2014/04/18,2014/04/11,,,read,,,,1,,,0,,,,,
25687685,Volta - O Segredo do Vale das Sombras,André Oliveira,"Oliveira, André",André Caetano,"=""""","=""9789898513267""",3,3.81,Polvo,Hardcover,96,2015,2015,2017/06/27,2017/06/27,,,read,,,,1,,,0,,,,,
91714,Civil War: A Marvel Comics Event,Mark Millar,"Millar, Mark","Steve McNiven, Dexter Vines, Morry Hollowell","=""078512179X""","=""9780785121794""",3,4.07,Marvel,Paperback,208,2007,2006,2017/06/27,2017/06/25,,,read,,,,1,,,0,,,,,
12719454,A Peste,Clem Martini,"Martini, Clem",,"=""""","=""9789728998738""",3,3.63,Quidnovi,,,2007,2005,2017/06/25,2017/06/19,,,read,,,,1,,,0,,,,,
29969797,Chernobyl: A Zona,Natacha Bustos,"Bustos, Natacha",Francisco Sánchez,"=""""","=""9789896825782""",4,3.64,Levoir,Hardcover,192,2016,2011,2017/06/25,2017/06/24,,,read,,,,1,,,0,,,,,
30301337,Os Vampiros,Filipe Melo,"Melo, Filipe",Juan Cavia,"=""""","=""9789896713201""",5,4.44,Edições Tinta-da-China,Hardcover,232,2016,2016,2017/06/24,2017/06/23,,,read,,,,1,,,0,,,,,
31286005,Parque Chas,Ricardo Barreiro,"Barreiro, Ricardo","Eduardo Risso, Carlos Xavier","=""""","=""9789896825850""",3,3.81,Levoir,Hardcover,152,2016,2006,2017/06/23,2017/06/18,,,read,,,,1,,,0,,,,,
6333673,O Rapaz que Chutava Porcos,Tom Baker,"Baker, Tom","David Roberts, Fernando Dias Antunes","=""9726955300""","=""9789726955306""",4,3.55,Editorial Teorema,Hardcover,132,2003,1999,2017/06/18,2017/06/16,,,read,,,,1,,,0,,,,,
22387819,As serpentes de água,Tony Sandoval,"Sandoval, Tony",,"=""""","=""9789898673053""",4,3.76,Kingpin Books,Hardcover,138,2014,2008,2017/06/16,2017/06/15,,,read,,,,1,,,0,,,,,
6854223,"Infecção (Infected, #1)",Scott Sigler,"Sigler, Scott",Leonor Bizarro Marques,"=""989557679X""","=""9789895576791""",4,3.84,Gailivro,Paperback,456,2009,2008,2017/06/15,2017/06/13,,,read,,,,1,,,0,,,,,
35267002,X-Men: Cisma (A Coleção Oficial de Graphic Novels Marvel #44),Jason Aaron,"Aaron, Jason",,"=""""","=""9788447128372""",4,3.72,Salvat,Hardcover,216,2017,2011,2017/06/08,2017/06/08,,,read,,,,1,,,0,,,,,
3288118,Uma Nova História Universal da Infâmia,Rhys Hughes,"Hughes, Rhys","Luís Rodrigues, Nuno Cotter","=""9729982937""","=""""",4,4.15,Livros de Areia,,212,2006,2004,2017/06/05,2017/05/26,,,read,,,,1,,,0,,,,,
31129059,A História de um Rato Mau,Bryan Talbot,"Talbot, Bryan","Neil Gaiman, Pedro Vieira de Moura","=""""","=""9789896825959""",3,3.90,Levoir,Hardcover,135,2016,1991,2017/06/03,2017/06/03,,,read,,,,1,,,0,,,,,
30736455,Terra de Sonhos,Jirō Taniguchi,"Taniguchi, Jirō","José H. Freitas, Shinji Iwaoka","=""""","=""9789896825829""",4,4.14,Levoir,Hardcover,176,2016,1991,2017/06/01,2017/06/02,,,read,,,,1,,,0,,,,,
32471507,História do Mundo (Vol. 1),Andrew Marr,"Marr, Andrew",,"=""""","=""""",4,3.65,LeYa,Paperback,143,,,2017/05/25,2017/05/15,,,read,,,,1,,,0,,,,,
23400071,Venom (Marvel Ultimate Graphic Novel Collection #68),Rick Remender,"Remender, Rick",Tony Moore,"=""""","=""9781909766560""",4,4.09,Hachette Partworks Ltd.,Hardcover,150,,2011,2017/05/16,2017/05/15,,,read,,,,1,,,0,,,,,
18908825,"Mort (Discworld, #4)",Terry Pratchett,"Pratchett, Terry",,"=""1473200105""","=""9781473200104""",5,4.21,Gollancz ,Hardcover,257,2013,1987,2017/05/15,2017/05/07,,,read,,,,1,,,0,,,,,
30754980,"Big Mushy Happy Lump (Sarah's Scribbles, #2)",Sarah Andersen,"Andersen, Sarah",,"=""1449479618""","=""9781449479619""",4,4.26,Andrews McMeel Publishing,Paperback,128,2017,2017,2017/05/13,2017/05/13,,,read,,,,1,,,0,,,,,
7875491,História Universal da Infâmia,Jorge Luis Borges,"Borges, Jorge Luis",José Bento,"=""""","=""9789896530129""",3,3.96,Leya,Paperback,93,2009,1935,2017/05/08,2017/05/05,,,read,,,,1,,,0,,,,,
34877042,Hulk: Destruição Total (A Coleção Oficial de Graphic Novels Marvel #41),Jeff Parker,"Parker, Jeff",,"=""""","=""9788447128341""",3,3.27,Salvat,,,2017,2011,2017/05/05,2017/05/04,,,read,,,,1,,,0,,,,,
30631566,V de Vingança,Alan Moore,"Moore, Alan","David   Lloyd, Pedro Vieira de Moura","=""""","=""9789896825812""",5,4.25,Levoir,Hardcover,288,2016,1990,2017/05/04,2017/04/17,,,read,,,,1,,,0,,,,,
4565192,Stardust - O Mistério da Estrela Cadente,Neil Gaiman,"Gaiman, Neil",Maria Georgina Segurado,"=""9722331401""","=""9789722331401""",2,4.08,Editorial Presença,Paperback,172,2004,1998,2017/05/01,2017/04/25,,,read,,,,1,,,0,,,,,
9969571,"Ready Player One (Ready Player One, #1)",Ernest Cline,"Cline, Ernest",,"=""030788743X""","=""9780307887436""",5,4.25,Crown Publishers,Hardcover,374,2011,2011,2017/04/29,2017/04/17,,,read,,,,1,,,0,,,,,
7202841,"Locke & Key, Vol. 3: Crown of Shadows",Joe Hill,"Hill, Joe",Gabriel Rodríguez,"=""1600106951""","=""9781600106958""",5,4.41,IDW Publishing,Hardcover,152,2013,2010,2017/04/16,2017/04/15,,,read,,,,1,,,0,,,,,
34795481,Vingadores: A Cruzada das Crianças (A Coleção Oficial de Graphic Novels Marvel #40),Allan Heinberg,"Heinberg, Allan",,"=""""","=""9788447128334""",4,4.25,Salvat,Hardcover,256,2017,2012,,2017/04/15,,,read,,,,1,,,0,,,,,
13510686,A Corte do Ar,Stephen Hunt,"Hunt, Stephen",Alberto Simões,"=""9896372934""","=""9789896372934""",3,3.30,Saída de Emergência,Paperback,507,2010,2007,2017/04/15,2017/03/18,,,read,,,,1,,,0,,,,,
13556942,"Chew, Vol. 5: Major League",John Layman,"Layman, John",Rob Guillory,"=""1607065231""","=""9781607065234""",4,4.12,Image Comics,Paperback,120,2012,2012,2017/04/04,2017/04/02,,,read,,,,1,,,0,,,,,
11325591,"Chew, Vol. 4: Flambé",John Layman,"Layman, John",,"=""1607063980""","=""9781607063988""",4,4.14,Image Comics,Paperback,120,2011,2011,2017/04/03,2017/04/02,,,read,,,,2,,,0,,,,,
9256590,"Chew, Vol. 3: Just Desserts",John Layman,"Layman, John",Rob Guillory,"=""1607063352""","=""9781607063353""",4,4.18,Image Comics,Paperback,128,2010,2010,2017/04/03,2017/04/02,,,read,,,,1,,,0,,,,,
7870457,"Chew, Vol. 2: International Flavor",John Layman,"Layman, John",Rob Guillory,"=""1607062607""","=""9781607062608""",4,4.09,Image Comics,Paperback,128,2010,2010,2017/04/02,2017/04/02,,,read,,,,1,,,0,,,,,
23634017,"Tony Chu, Detective Canibal - Vol. 1: Ao Gosto do Freguês",John Layman,"Layman, John","Rob Guillory, José Hartvig de Freitas","=""""","=""9788791630873""",4,3.95,G. Floy Studio,Hardcover,128,2014,2009,2017/04/02,2014/12/17,,,read,,,,2,,,0,,,,,
6120349,"Locke & Key, Vol. 2: Head Games",Joe Hill,"Hill, Joe",Gabriel Rodríguez,"=""""","=""""",5,4.33,IDW Publishing,Hardcover,160,2015,2009,2017/03/31,2017/03/31,,,read,,,,1,,,0,,,,,
3217221,"Locke & Key, Vol. 1: Welcome to Lovecraft",Joe Hill,"Hill, Joe",Gabriel Rodríguez,"=""1600102379""","=""9781600102370""",5,4.15,IDW Publishing,Hardcover,168,2013,2008,2017/03/31,2016/03/28,,,read,,,,2,,,0,,,,,
9209985,Shadowland: Daredevil,Andy Diggle,"Diggle, Andy","Roberto de la Torre, Antony Johnston","=""0785149902""","=""9780785149903""",4,2.98,Marvel,Hardcover,120,2011,2011,2017/03/28,2017/03/28,,,read,,,,1,,,0,,,,,
13832131,A Mathematician's Apology,G.H. Hardy,"Hardy, G.H.",C.P. Snow,"=""110760463X""","=""9781107604636""",4,3.93,Cambridge University Press,Paperback,153,2012,1940,2017/03/27,2017/03/26,,,read,,,,1,,,0,,,,,
23015798,"Universo Marvel: Marvels (Colecção Universo Marvel, #7)",Kurt Busiek,"Busiek, Kurt",Alex Ross,"=""""","=""9789896824518""",5,4.25,Levoir,Hardcover,224,2014,1993,2014/09/20,2014/09/18,,,read,,,,1,,,0,,,,,
33977826,Lovesenda ou o Enigma das Oito Portas de Cristal,António de Macedo,"Macedo, António de","Mário de Seabra Coelho, Pedro Cipriano, Filipe Coelho, Rúben Botelho","=""""","=""9789899899643""",5,4.67,Editorial Divergência,Paperback,507,2017,,2017/01/31,2017/03/18,,,read,"Um extraordinário livro em que a voz de António de Macedo é reconhecível a partir da primeira palavra. E até do título. Um livro que dispensa explicações de um autor que dispensa apresentações. O cenário medieval é perfeito, como não podia deixar de ser, e o enredo místico parece quase uma prova de iniciátiva para quem lê. O final não me deixou completamente satisfeito, mas não há dúvida que estamos perante uma verdadeira obra-prima, um clássico instantâneo e um marco na ficção Fantástica nacional!",,,1,,,0,,,,,
18525375,Galileu na Prisão e Outros Mitos Sobre Ciência e Religião,Ronald L. Numbers,"Numbers, Ronald L.",,"=""9896164770""","=""9789896164775""",3,3.69,Gradiva,Paperback,340,2012,2009,2017/03/16,2016/10/31,,,read,,,,1,,,0,,,,,
34383207,O Imperativo Thanos (A Coleção Oficial de Graphic Novels Marvel #37),Dan Abnett,"Abnett, Dan",,"=""""","=""9788447128303""",4,3.64,Salvat,Hardcover,200,2017,,2017/03/13,2017/03/12,,,read,,,,1,,,0,,,,,
34183420,Deadpool: A Guerra de Wade Wilson (A Coleção Oficial de Graphic Novels Marvel #36),Duane Swierczynski,"Swierczynski, Duane",,"=""""","=""9788447128297""",3,4.08,,Hardcover,136,2017,2010,2017/03/12,2017/03/11,,,read,,,,1,,,0,,,,,
33986633,Vingadores Secretos: Missão a Marte (A Coleção Oficial de Graphic Novels Marvel #35),Ed Brubaker,"Brubaker, Ed",Mike Deodato,"=""""","=""9788447128280""",3,3.72,Salvat,Hardcover,136,2016,2011,2017/03/11,2017/03/10,,,read,,,,1,,,0,,,,,
33831515,Vingadores: Primordial (A Coleção Oficial de Graphic Novels Marvel #34),Brian Michael Bendis,"Bendis, Brian Michael",Alan Davis,"=""""","=""9788447128273""",3,3.74,Salvat,Hardcover,136,2017,2011,2017/03/10,2017/03/09,,,read,,,,1,,,0,,,,,
33353860,Homem-Aranha: Azul (A Coleção Oficial de Graphic Novels Marvel #32),Jeph Loeb,"Loeb, Jeph",Tim Sale,"=""""","=""9788447128259""",4,4.15,Salvat,Hardcover,160,2016,2004,2017/03/06,2017/03/04,,,read,,,,1,,,0,,,,,
31942120,Proxy,Carlos Silva,"Silva, Carlos","José Pedro Castro, Júlia Durand, Mário de Seabra Coelho, Marta Silva, Vitor Frazão, Anton Stark, Matthias Sanne","=""""","=""9789899899650""",3,3.67,Editorial Divergência,Paperback,223,2016,,2017/03/04,2017/02/26,,,read,,,,1,,,0,,,,,
18748788,As Fantásticas Aventuras de Dog Mendonça e Pizzaboy III: Requiem,Filipe Melo,"Melo, Filipe","Juan Cavia, Santiago Villa","=""""","=""9789896711870""",4,4.24,Tinta da China,Paperback,128,2013,2013,2017/02/20,2017/02/19,,,read,,,,1,,,0,,,,,
13065030,As Extraordinárias Aventuras de Dog Mendonça e Pizzaboy II: Apocalipse,Filipe Melo,"Melo, Filipe",Juan Cavia,"=""""","=""9789896710996""",4,4.13,Tinta-da-China,Paperback,112,2011,2011,2017/02/19,2013/04/30,,,read,,,,2,,,0,,,,,
8016118,As Incríveis Aventuras de Dog Mendonça e PizzaBoy,Filipe Melo,"Melo, Filipe",Juan Cavia,"=""""","=""9789896710279""",4,3.97,Tinta-da-China,Paperback,120,2010,2010,2017/02/19,2013/04/21,,,read,,,,2,,,0,,,,,
32993094,Capitão Bretanha: Um Mundo ao Contrário (A Coleção Oficial de Graphic Novels Marvel #30),Alan Moore,"Moore, Alan",Alan Davis,"=""""","=""9788447128235""",4,3.84,Salvat,Hardcover,200,2016,2002,2017/02/19,2017/02/12,,,read,,,,2,,,0,,,,,
32336454,A Biblioteca à Noite,Alberto Manguel,"Manguel, Alberto",Rita Almeida Simões,"=""""","=""9789896713409""",5,3.99,Edições Tinta-da-China,Paperback,304,2016,2006,2017/02/17,2017/01/30,,,read,,,,1,,,0,,,,,
6365144,101 Illnesses You Don't Want To Get,Michael Powell,"Powell, Michael",Oliver Fischer,"=""1844033899""","=""9781844033898""",3,3.60,Cassell Illustrated,Paperback,144,,,2017/02/12,2017/02/12,,,read,,,,1,,,0,,,,,
32672269,1602 (A Coleção Oficial de Graphic Novels Marvel #28),Neil Gaiman,"Gaiman, Neil",Andy Kubert,"=""""","=""9788447128211""",5,3.94,Salvat,Hardcover,,2016,2003,2017/02/02,2017/01/27,,,read,,,,1,,,0,,,,,
20493914,"Equal Rites (Discworld, #3)",Terry Pratchett,"Pratchett, Terry",,"=""1473200202""","=""9781473200203""",5,4.01,Gollancz,Hardcover,256,2014,1987,2017/01/30,2017/01/23,,,read,,,,1,,,0,,,,,
25855506,"Adulthood Is a Myth (Sarah's Scribbles, #1)",Sarah Andersen,"Andersen, Sarah",,"=""1449474195""","=""9781449474195""",3,4.12,Andrews McMeel Publishing,Paperback,112,2016,2016,2017/01/27,2017/01/24,,,read,,,,1,,,0,,,,,
21555974,Pride of Baghdad,Brian K. Vaughan,"Vaughan, Brian K.",Niko Henrichon,"=""1401248942""","=""9781401248949""",5,3.89,Vertigo,Hardcover,168,2014,2006,2017/01/24,2017/01/22,,,read,,,,1,,,0,,,,,
33023824,No Enxame - Reflexões Sobre o Digital,Byung-Chul Han,"Han, Byung-Chul",Miguel Serras Pereira,"=""""","=""9789896416553""",1,3.84,Relógio D'Água,Paperback,104,2016,2013,2017/01/22,2017/01/19,,,read,,,,1,,,0,,,,,
16034968,O Vendedor de Passados,José Eduardo Agualusa,"Agualusa, José Eduardo",,"=""""","=""9789722050739""",4,3.82,Publicações Dom Quixote,Paperback,384,2006,2004,2015/06/24,2015/06/21,,,read,,,,1,,,0,,,,,
22997383,Storm,Tim Minchin,"Minchin, Tim",,"=""""","=""""",5,4.36,Orion,Hardcover,112,2014,2014,2016/12/27,2016/12/27,,,read,"Para um livro que arrasa completamente várias coisas, incluindo pessoas que dizem prever o futuro, faz um excelente trabalho a prever uma situação que vai acontecer de certeza na minha vida, mais do que uma vez.",,,1,,,0,,,,,
9469560,Gabo: Memórias da Memória,Carlos Fuentes,"Fuentes, Carlos",Maria do Carmo Abreu,"=""9722024485""","=""""",3,3.00,Dom Quixote,Paperback,48,2003,2003,2016/12/17,2016/12/17,,,read,,,,1,,,0,,,,,
32504334,O entrelaçamento electroquântico de que são feitas as lendas (Comandante Serralves),Rui Bastos,"Bastos, Rui",,"=""""","=""9781370036851""",0,4.00,Imaginauta,ebook,,2016,,,2016/10/09,,,read,,,,1,,,0,,,,,
16080576,100 Coisas para Fazer (Depois de Morrer),Viton Araújo,"Araújo, Viton",Gustavo Nardini,"=""""","=""9789896920357""",3,3.44,ArtePlural Edições,Paperback,208,2012,2012,2016/12/12,2016/12/10,,,read,,,,1,,,0,,,,,
8546155,"Grave Humor: Funny, Ironic, and Ridiculous Tombstones",Family Tree Magazine,"Magazine, Family Tree",,"=""1440308853""","=""9781440308857""",4,3.23,Family Tree Books,Paperback,144,2010,2010,2016/12/10,2016/12/10,,,read,,,,1,,,0,,,,,
8608120,Um Catálogo de Sonhos,José Carlos Fernandes,"Fernandes, José Carlos",,"=""9895591039""","=""9789895591039""",2,3.50,Edições Devir,Paperback,48,2004,1996,2016/12/10,2016/12/10,,,read,,,,1,,,0,,,,,
18692452,Green Lantern: Rebirth (New Edition),Geoff Johns,"Johns, Geoff","Van Sciver, Ethan","=""""","=""9781401236403""",3,4.12,DC Comics,Kindle Edition,192,2011,2005,2013/12/04,2013/12/03,,,read,,,,1,,,0,,,,,
32183048,O Poderoso Thor: Em Busca dos Deuses (A Coleção Oficial de Graphic Novels Marvel #26),Dan Jurgens,"Jurgens, Dan",John Romita Jr.,"=""""","=""9788447128198""",3,3.28,Salvat,Hardcover,200,2016,2012,2016/11/03,2016/11/03,,,read,,,,1,,,0,,,,,
31924448,O Incrível Hulk: Gritos Silenciosos (A Coleção Oficial de Graphic Novels Marvel #25,Peter David,"David, Peter",Dale Keown,"=""""","=""9788447128181""",3,3.73,Salvat,Hardcover,200,2016,1990,2016/11/01,2016/11/01,,,read,,,,1,,,0,,,,,
29965119,La poesía de los números,Antonio J. Durán Guardeño,"Guardeño, Antonio J. Durán",,"=""""","=""""",3,3.60,,Hardcover,,,2011,2016/10/31,2016/10/25,,,read,"O livro apresenta algumas coisas interessantes, mas revela-se demasiado curto, para os objectivos a que se propõe.",,,1,,,0,,,,,
31831253,Fogos e Murmúrio,Lorenzo Mattotti,"Mattotti, Lorenzo","Jerry Kramsky, Carlos Xavier, Frederica Claro de Armada","=""""","=""9789896825911""",2,3.14,Levoir,Hardcover,126,2016,2010,2016/10/28,2016/10/26,,,read,"Arte interessante, histórias etéras mas que não fazem o meu estilo. O tom excessivamente filosófico e metafórico conseguiu apenas desligar-me completamente da narrativa.",,,1,,,0,,,,,
29340828,O Espaço Vazio,Dick Haskins,"Haskins, Dick",,"=""9724132749""","=""""",1,3.34,Sábado,Paperback,188,2016,1962,2016/10/22,2016/10/18,,,read,"*Antes de ler as últimas 10 páginas*<br/><br/>Formulaico, monótono, básico, personagens com zero de profundidade, diálogos sofríveis, história sem um pingo de interesse e escrita banal.<br/><br/>*Depois de ler as últimas 10 páginas*<br/><br/>Estúpido, profundamente idiota e, diria até, insultuoso para o leitor. Ridículo! Já há muito tempo que não lia um desfecho tão absurdo para um policial. É de trepar paredes. Horrível. Execrável. Só à chapada!",,,1,,,0,,,,,
31198679,A Garagem Hermética,Mœbius,"Mœbius, Mœbius",José De Freitas,"=""""","=""9789896825867""",2,4.21,Levoir,Hardcover,120,2016,1979,2016/10/22,2016/10/19,,,read,"A história confusa e maioritariamente improvisada não me convenceu. Vale pelo imaginário e pelo(s) universo(s) criado(s), bem como pela arte, tão típica de Moebius.",,,1,,,0,,,,,
32193710,Os Exércitos do Conquistador,Jean-Pierre Dionnet,"Dionnet, Jean-Pierre","Jean-Claude Gal, João Miguel Lameiras, Hugo Jesus","=""""","=""9789896825942""",5,4.02,Levoir,Hardcover,191,2016,2002,2016/10/14,2016/10/10,,,read,"Sublime! A arte super detalhada é extraordinária, e embora os diálogos sejam ocasionalmente dolorosos, as histórias contidas neste livro inserem-se na tradição pulp ao mesmo tempo que parecem ser episódios de uma Twilight Zone de um passado ficcional muito parecido à América do Sul de Aztecas, Maias e Incas.<br/><br/>Finais em aberto convivem com finais perfeitamente circulares, reviravoltas encontram-se a meio caminho com épicas histórias de vingança, e o horror mistura-se com um tipo muito particular de sword and sorcery, e há ainda tempo para um ligeiro toque de ficção científica<br/><br/>Basta dizer-vos que o livro tem quase 200 páginas, e que eu depois das primeiras 20 já lhe tinha dado 5 estrelas na minha cabeça. E depois não me desiludi! Verdadeiramente impressionante... E não esquecer a arte e a própria planificação das vinhetas, divinal em todos os seus aspectos.",,,1,,,0,,,,,
26859623,O Barão Aventureiro,Carlos A. Cornejo,"Cornejo, Carlos A.",Chiqui de La Fuente,"=""""","=""""",3,3.46,Edições FP,Paperback,46,,1975,2016/10/07,2016/10/07,,,read,"Comprei este livro por quase nada, e apenas por já conhecer o filme, completamente psicadélico. O espírito é o mesmo, completamente louco, mas a forma de contar a história parece estranhamente... datada.",,,1,,,0,,,,,
6759154,"I'll Give It My All...Tomorrow, Vol. 1",Shunju Aono,"Aono, Shunju",,"=""1421533650""","=""9781421533650""",2,3.63,VIZ Media LLC,Paperback,208,2010,2007,2016/10/06,2016/10/06,,,read,"Uma arte sofrível e uma história que não leva a lado nenhum. Por mais que se possa pensar nisso, acompanhar um falhado enquanto ele falha não é particularmente interessante. Pelo menos não quando é feito desta maneira, e se nota uma certa limitação a desenhar personagens diferentes e nas expressões que cada uma é capaz de fazer...",,,1,,,0,,,,,
9672231,Off Road,Sean Gordon Murphy,"Murphy, Sean Gordon",,"=""""","=""""",3,3.69,Kingpin Books,Paperback,128,2010,2005,2016/10/05,2016/10/05,,,read,"Um livro engraçado, mas nada de especial. Três rapazolas desenquadrados nas suas respectivas vidas decidem pegar no jipe novo de um deles e partir para o meio do mato. As coisas não correm da melhor forma, mas depois tudo fica bem (até melhor). Fim. Podia ter sido melhor, podia ter sido pior... lê-se num instante e, enfim, não é nada de especial.",,,1,,,0,,,,,
13558889,Persépolis,Marjane Satrapi,"Satrapi, Marjane",,"=""""","=""9789896661120""",4,4.36,Contraponto,Paperback,352,2012,2003,2016/09/30,2016/09/27,,,read,"Muito interessante pelo contexto político que oferece, mas a estrutura torna-se de certa forma repetitiva. A arte não é brilhante, mas não é esse o objectivo... É fascinante ver os desafios que uma iraniana enfrentou nos últimos anos com a revolução islâmica e a guerra.",,,1,,,0,,,,,
256747,As espadas da noite e do dia,David Gemmell,"Gemmell, David",Maria Georgina Segurado,"=""972233526X""","=""9789722335263""",5,4.32,Editorial Presença,Paperback,444,2006,2004,,2010/05/30,,,read,,,,1,,,0,,,,,
13353922,Três Sombras,Cyril Pedrosa,"Pedrosa, Cyril",,"=""""","=""""",5,4.06,Quadrinhos na Cia.,Graphic Novel,272,2011,2007,2016/09/27,2016/09/25,,,read,"Absolutamente fantástico. Uma história emocional, bem contada e sem medo das consequências. A arte complementa perfeitamente o texto e faz deste um livro tremendo sobre o destino, a família, a aceitação e o sacrifício!",,,1,,,0,,,,,
31435237,Valentina,Guido Crepax,"Crepax, Guido","José De Freitas, João Miguel Lameiras","=""""","=""9789896825881""",2,2.77,Levoir,Hardcover,176,2016,,2016/09/25,2016/09/25,,,read,"Confirmaram-se as minhas suspeitas de quando ia a meio do livro. Arte excepcional, pelo menos no que toca à configuração das páginas, mas a quase-ausência de história, e o facto de que a história que existe ser confusa e sonhada e sei lá mais o quê, faz com que o livro não tenha muito interesse para além do visual. Ganha pontos pela forma original como conta a ""história"", e pelas homenagens ao mundo da BD que estão presentes na última das três histórias, ""Valentina no metro"", mas pouco mais que isso.",,,1,,,0,,,,,
31221006,"Mulher-Hulk: Solteira, Verde, Perigosa (A Coleção Oficial de Graphic Novels Marvel #22)",Dan Slott,"Slott, Dan",,"=""""","=""9788447128150""",3,4.07,Salvat,Hardcover,144,2016,2004,2016/09/17,2016/09/17,,,read,,,,1,,,0,,,,,
31344235,"Fatale, Vol. 5: Amaldiçoa o Demónio",Ed Brubaker,"Brubaker, Ed",Sean Phillips,"=""""","=""9788416510160""",4,3.97,G. Floy Studio,Hardcover,152,2016,2014,2016/09/17,2016/09/12,,,read,,,,1,,,0,,,,,
29758285,"Fatale, Vol. 4: As Lágrimas do Céu",Ed Brubaker,"Brubaker, Ed",,"=""""","=""9788416510078""",3,4.08,G. Floy Studio,Hardcover,128,2016,2014,2016/09/12,2016/09/12,,,read,,,,1,,,0,,,,,
29069989,"Harry Potter and the Cursed Child, Parts 1 & 2 (Harry Potter #8)",John Tiffany,"Tiffany, John","Jack Thorne, J.K. Rowling","=""1338099132""","=""9781338099133""",3,3.60,Arthur A. Levine Books,Hardcover,309,2016,2016,2016/09/12,2016/09/11,,,read,,,,1,,,0,,,,,
29545538,O Aprendiz de Gutenberg,Alix Christie,"Christie, Alix",Jorge Candeias,"=""9896379246""","=""9789896379247""",3,3.48,Saída de Emergência,Paperback,390,2016,2014,2016/09/11,2016/08/25,,,read,,,,1,,,0,,,,,
5739442,"A Guerra dos Tronos (As Crónicas de Gelo e Fogo, #1)",George R.R. Martin,"Martin, George R.R.",Jorge Candeias,"=""9896370109""","=""9789896370107""",4,4.30,Edições Saída de Emergência,Paperback,400,2007,1996,2013/08/30,2013/08/26,,,read,,,,1,,,0,,,,,
6278019,Heart's Blood,Juliet Marillier,"Marillier, Juliet",,"=""0230017916""","=""9780230017917""",3,4.09,Tor/Pan Macmillan UK,Hardcover,405,2009,2009,2016/08/24,2016/08/11,,,read,,,,1,,,0,,,,,
7150186,"Os Túmulos de Atuan (Ciclo de Terramar, #2)",Ursula K. Le Guin,"Guin, Ursula K. Le",Carlos Grifo Babo,"=""9722328751""","=""9789722328753""",3,4.08,Editorial Presença,Paperback,149,2002,1970,2015/07/27,2015/07/23,,,read,,,,1,,,0,,,,,
12656183,"O Regresso dos Dragões (A Idade das Trevas, #1)",A.J. Lake,"Lake, A.J.",Maria de Fátima St. Aubyn,"=""""","=""9789896280833""",3,3.57,Quidnovi,Mass Market Paperback,230,2008,2006,2015/03/14,2015/03/11,,,read,,,,1,,,0,,,,,
12656211,"O Livro da Espada (A Idade das Trevas, #2)",A.J. Lake,"Lake, A.J.",Maria de Fátima St. Aubyn,"=""""","=""9789896280840""",3,3.65,Quidnovi,Mass Market Paperback,223,2008,2007,2015/03/24,2015/03/15,,,read,,,,1,,,0,,,,,
25389194,Os Cadáveres,Pedro Cipriano,"Cipriano, Pedro",,"=""""","=""9781311907486""",3,3.00,Fantasy&Co,ebook,,2015,2015,,2016/08/16,,,read,"Um conto interessante, mas que sofre pela forma. O facto de ser um único parágrafo grande não joga a seu favor, pois obriga a uma leitura monótona que as frases curtas não conseguem combater. ",,,1,,,0,,,,,
29763587,História da China,Stephen G. Haw,"Haw, Stephen G.",,"=""""","=""9789896712938""",5,3.48,Tinta da China,Paperback,375,2016,1995,2016/08/10,2016/07/21,,,read,,,,1,,,0,,,,,
31076893,Os Surpreendentes X-Men: Perigosa (A Coleção Oficial de Graphic Novels Marvel #21),Joss Whedon,"Whedon, Joss",John Cassaday,"=""""","=""9788447128143""",3,4.19,Salvat,Hardcover,160,2016,2005,2016/07/30,2016/07/30,,,read,,,,1,,,0,,,,,
2911494,Captain America: The Chosen,David Morrell,"Morrell, David",Mitch Breitweiser,"=""0785129057""","=""9780785129059""",2,3.57,Marvel,Hardcover,168,2008,2008,2016/07/30,2016/07/29,,,read,,,,1,,,0,,,,,
6987256,A Mecânica do Coração,Mathias Malzieu,"Malzieu, Mathias","Irene Daun e Lorena, Nuno Daun e Lorena","=""9896660204""","=""9789896660208""",3,3.61,Contraponto,Paperback,143,2009,2007,2016/07/21,2016/07/17,,,read,,,,1,,,0,,,,,
30553877,Pantera Negra: Quem é o Pantera Negra? (A Coleção Oficial de Graphic Novels Marvel #19),Reginald Hudlin,"Hudlin, Reginald","John Romita Jr., Caio Lopes, Dorival Vitor Lopes","=""""","=""9788447128129""",3,3.82,Salvat,Hardcover,160,2016,2005,2016/07/20,2016/07/20,,,read,,,,1,,,0,,,,,
9647295,"The Way of Kings (The Stormlight Archive, #1)",Brandon Sanderson,"Sanderson, Brandon",,"=""0765365278""","=""9780765365279""",4,4.61,Tom Doherty,Mass Market Paperback,1258,2011,2010,2016/07/17,2016/06/25,,,read,,,,1,,,0,,,,,
31132194,"Eternos (Coleção Oficial Graphic Novels Marvel, #18)",Neil Gaiman,"Gaiman, Neil",John Romita Jr.,"=""""","=""9788447128112""",3,3.62,Editorial Salvat,Hardcover,150,2016,2006,2016/07/16,2016/07/16,,,read,,,,1,,,0,,,,,
